{
  "version": 1,
  "bundleId": "art_20260620_blog_builder:rev_001:zoositioweb.com.mx:es",
  "hubId": "zoosite-main",
  "articleId": "art_20260620_blog_builder",
  "revisionId": "rev_001",
  "ownerDraftDomain": "zoositioweb.com.mx",
  "renderDomain": "zoositioweb.com.mx",
  "locale": "es",
  "path": "/blog/web/blog-builder-seo",
  "safeArticlePath": "/blog/web/blog-builder-seo",
  "status": "published",
  "publishedAt": "2026-06-21T15:00:00.000Z",
  "previewedAt": "",
  "title": "Blog builder visual con SEO desde el inicio",
  "summary": "Cómo Zoosite prepara un blog editable con componentes genéricos, rutas limpias, publicación programada y medición propia.",
  "slug": "blog-builder-seo",
  "category": {
    "taxonomyId": "cat_web",
    "slug": "web",
    "label": "Web"
  },
  "tags": [
    {
      "taxonomyId": "tag_seo",
      "slug": "seo",
      "label": "SEO"
    }
  ],
  "commentPolicy": "moderated",
  "contentSafety": {
    "rating": "general",
    "warnings": []
  },
  "interactions": {
    "ctas": { "enabled": true, "moderation": "spam-check" },
    "reactions": { "enabled": true, "moderation": "spam-check" },
    "shares": { "enabled": true },
    "readProgress": { "enabled": true },
    "assetDownloads": { "enabled": false },
    "forms": { "enabled": false }
  },
  "seo": {
    "title": "Blog builder visual con SEO desde el inicio",
    "description": "Cómo Zoosite prepara un blog editable con componentes genéricos, rutas limpias, publicación programada y medición propia.",
    "canonical": "/blog/web/blog-builder-seo",
    "canonicalMode": "self",
    "robots": "index,follow"
  },
  "structuredData": [
    {
      "type": "Article",
      "json": {
        "@context": "https://schema.org",
        "@type": "Article",
        "headline": "Blog builder visual con SEO desde el inicio",
        "inLanguage": "es",
        "mainEntityOfPage": "https://zoositioweb.com.mx/blog/web/blog-builder-seo"
      }
    },
    {
      "type": "BreadcrumbList",
      "json": {
        "@context": "https://schema.org",
        "@type": "BreadcrumbList",
        "itemListElement": [
          {
            "@type": "ListItem",
            "position": 1,
            "name": "Blog",
            "item": "https://zoositioweb.com.mx/blog"
          },
          {
            "@type": "ListItem",
            "position": 2,
            "name": "Web",
            "item": "https://zoositioweb.com.mx/blog/web"
          }
        ]
      }
    }
  ],
  "components": [
      {
        "id": "articleRoot",
        "type": "container",
        "config": {
          "components": [
            "articleTitle",
            "articleCover",
            "articleIntro",
            "articleBody",
            "articleCta"
          ],
          "classes": "ank-minHeight-100vh ank-bg-bgColor ank-color-textColor ank-display-flex ank-flexDirection-column ank-alignItems-center ank-p-24px ank-gap-24px"
        }
      },
      {
        "id": "articleCover",
        "type": "media",
        "config": {
          "tag": "image",
          "src": "https://assets.zoolandingpage.com.mx/zoolandingpage.com.mx/shared/seo-images/zoolandingpage-zoositioweb-default-logo-card.jpg",
          "alt": "Vista del editor visual de artículos de Zoosite",
          "classes": "ank-width-100per ank-maxWidth-920px ank-borderRadius-8px ank-objectFit-cover"
        }
      },
      {
        "id": "articleTitle",
        "type": "text",
        "config": {
          "tag": "h1",
          "text": "Blog builder visual con SEO desde el inicio",
          "classes": "ank-m-0 ank-maxWidth-920px ank-fontSize-42px ank-lineHeight-1_08 ank-fontWeight-900 ank-color-titleColor"
        }
      },
      {
        "id": "articleIntro",
        "type": "text",
        "config": {
          "tag": "p",
          "text": "Este artículo semilla prueba el flujo sin AWS real: se crea un paquete, se valida, se publica como bundle público y se lee desde una ruta SEO.",
          "classes": "ank-width-100per ank-maxWidth-760px ank-m-0 ank-fontSize-17px ank-lineHeight-1_7"
        }
      },
      {
        "id": "articleBody",
        "type": "text",
        "config": {
          "tag": "p",
          "text": "La estructura mantiene el contenido pesado en archivos tipo draft y deja DynamoDB para metadatos, slugs, taxonomía, programación, revisión y relaciones entre hubs autorizados.",
          "classes": "ank-width-100per ank-maxWidth-760px ank-m-0 ank-fontSize-17px ank-lineHeight-1_7"
        }
      },
      {
        "id": "articleCta",
        "type": "link",
        "eventInstructions": "trackEvent:blog_cta_click,blog,zoosite-blog-builder-cta,hubId,zoosite-main,articleId,art_20260620_blog_builder,ctaId,primary-consultation",
        "config": {
          "text": "Planear mi blog",
          "href": "/contacto",
          "classes": "ank-minHeight-48px ank-px-22px ank-borderRadius-8px ank-bg-accentColor ank-color-onSuccessColor ank-fontWeight-900 ank-border-0 ank-cursor-pointer"
        }
      }
  ],
  "variables": {
    "article": {
      "hubId": "zoosite-main",
      "articleId": "art_20260620_blog_builder",
      "categorySlug": "web",
      "slug": "blog-builder-seo",
      "locale": "es",
      "contentGroup": "blog"
    }
  },
  "i18n": {
    "article.title": "Blog builder visual con SEO desde el inicio",
    "article.cta": "Planear mi blog"
  },
  "analytics": {
    "contentGroup": "blog",
    "eventPrefix": "blog",
    "piiPolicy": "no-pii"
  }
}
